9:17 AM 7/18/2018

DBMS
====

SQL> 	create table persons 
	(
		lastName varchar(20),
		firstName varchar(20),
		address varchar(20), 
		city char(20) 
	);

Table created.

====

SQL> desc persons 
 Name                                      Null?    Type
 ----------------------------------------- -------- ----------------------------
 LASTNAME                                           VARCHAR2(20)
 FIRSTNAME                                          VARCHAR2(20)
 ADDRESS                                            VARCHAR2(20)
 CITY                                               CHAR(20)

SQL> select * from persons;

no rows selected

SQL> insert into persons values('noronha','jason','mabukala','udupi');


1 row created.

SQL> select * from persons;

LASTNAME             FIRSTNAME            ADDRESS
-------------------- -------------------- --------------------
CITY
--------------------
henson               ola                  bengaluru
whitefield

kurmude              riya                 hostel
mangaluru

shetty               bhakthi              kaup
kaup

sreekumar            sneha                ajjarkad
udupi

bhat                 sanjana              ambalpady
udupi

kamath               kiran                hiriadka
udupi

kamath               sudhindra            mulky
udupi

patkar               arvind               parkala
udupi

salian               akarsh               ambalpady
udupi

noronha              jason                mabukala
udupi


10 rows selected.

====

CRUD - Create Read Update Delete

===

SQL> update persons set firstname='RITA' where lastname='kurmude';


SQL> select city, count(city) from persons group by city;

CITY                 COUNT(CITY)
-------------------- -----------
whitefield                     1
mangaluru                      1
kaup                           1
udupi                          7

SQL> select * from employee;

NAME                     SALARY DEPARTMENT
-------------------- ---------- ----------
Jason                     20000 IT
Sanjana                   19000 IT
Arvind                    20000 IT
Anfal                     21000 Sales
Kiran                     18000 Sales
Sudhindra                 19000 Sales
Akarsh                    20000 IT

7 rows selected.

SQL> select department, sum(salary) from employee group by department;

DEPARTMENT SUM(SALARY)
---------- -----------
Accounts         46000
Marketing        40000
IT               79000
Sales            58000

SQL> select department, count(*) from employee group by department;

DEPARTMENT   COUNT(*)
---------- ----------
Accounts            3
Marketing           2
IT                  4
Sales               3



SQL> select * from employee order by name;

NAME                     SALARY DEPARTMENT
-------------------- ---------- ----------
Afroz                     17000 Accounts
Akarsh                    20000 IT
Anam                      12000 Accounts
Anfal                     21000 Sales
Ankush                    20000 Marketing
Arvind                    20000 IT
Jason                     20000 IT
Kiran                     18000 Sales
Mahesh                    20000 Marketing
Sanjana                   19000 IT
Sudhindra                 19000 Sales

SQL> select name from employee where salary=(select max(salary) from employee);

NAME
--------------------
Anfal

